{
  "$schema": "./scan-repositories.schema.json",
  "version": "1.0.0",
  "scanConfig": {
    "enabled": true,
    "schedule": "0 2 * * *",
    "maxRepositoriesPerNight": 10,
    "maxConcurrentScans": 3,
    "scanTimeout": 600000,
    "retryAttempts": 2,
    "retryDelay": 60000
  },
  "cacheConfig": {
    "enabled": true,
    "provider": "redis",
    "ttl": 2592000,
    "invalidateOnChange": true,
    "trackGitCommits": true,
    "trackUncommittedChanges": true
  },
  "repositories": [
    {
      "name": "sidequest",
      "path": "/Users/alyshialedlie/code/jobs/sidequest",
      "priority": "high",
      "scanFrequency": "daily",
      "enabled": true,
      "tags": [
        "internal",
        "job-management"
      ],
      "excludePatterns": [
        "*.test.js",
        "*.spec.js",
        "pipeline-core/**"
      ],
      "lastScannedAt": "2026-03-11T07:00:04.579Z",
      "scanHistory": [
        {
          "timestamp": "2026-03-11T07:00:04.579Z",
          "status": "success",
          "duration": 3.506,
          "duplicatesFound": 0
        },
        {
          "timestamp": "2026-03-11T07:00:03.618Z",
          "status": "success",
          "duration": 3.445,
          "duplicatesFound": 0
        },
        {
          "timestamp": "2026-03-10T07:00:10.509Z",
          "status": "success",
          "duration": 2.794,
          "duplicatesFound": 0
        },
        {
          "timestamp": "2026-03-09T07:00:39.035Z",
          "status": "success",
          "duration": 6.245,
          "duplicatesFound": 0
        },
        {
          "timestamp": "2026-02-27T08:00:09.621Z",
          "status": "success",
          "duration": 3.892,
          "duplicatesFound": 0
        },
        {
          "timestamp": "2026-02-25T07:01:50.795Z",
          "status": "success",
          "duration": 109.69,
          "duplicatesFound": 0
        },
        {
          "timestamp": "2026-02-25T07:01:04.057Z",
          "status": "success",
          "duration": 63.23,
          "duplicatesFound": 3
        },
        {
          "timestamp": "2026-02-24T07:03:43.600Z",
          "status": "success",
          "duration": 221.818,
          "duplicatesFound": 0
        },
        {
          "timestamp": "2026-02-24T07:02:09.149Z",
          "status": "success",
          "duration": 127.361,
          "duplicatesFound": 3
        },
        {
          "timestamp": "2026-02-23T07:01:42.203Z",
          "status": "success",
          "duration": 101,
          "duplicatesFound": 0
        }
      ]
    },
    {
      "name": "pipeline-core",
      "path": "/Users/alyshialedlie/code/jobs/sidequest/pipeline-core",
      "priority": "high",
      "scanFrequency": "daily",
      "enabled": true,
      "tags": [
        "internal",
        "duplicate-detection"
      ],
      "excludePatterns": [
        "*.test.js",
        "*.spec.js"
      ],
      "lastScannedAt": "2026-03-11T07:00:04.579Z",
      "scanHistory": [
        {
          "timestamp": "2026-03-11T07:00:04.579Z",
          "status": "success",
          "duration": 3.506,
          "duplicatesFound": 0
        },
        {
          "timestamp": "2026-03-11T07:00:03.618Z",
          "status": "success",
          "duration": 2.799,
          "duplicatesFound": 0
        },
        {
          "timestamp": "2026-03-10T07:00:10.510Z",
          "status": "success",
          "duration": 2.794,
          "duplicatesFound": 0
        },
        {
          "timestamp": "2026-03-09T07:00:39.035Z",
          "status": "success",
          "duration": 6.245,
          "duplicatesFound": 0
        },
        {
          "timestamp": "2026-02-27T08:00:09.622Z",
          "status": "success",
          "duration": 3.892,
          "duplicatesFound": 0
        },
        {
          "timestamp": "2026-02-25T07:01:50.807Z",
          "status": "success",
          "duration": 109.69,
          "duplicatesFound": 0
        },
        {
          "timestamp": "2026-02-25T07:01:02.623Z",
          "status": "success",
          "duration": 61.706,
          "duplicatesFound": 0
        },
        {
          "timestamp": "2026-02-24T07:03:43.723Z",
          "status": "success",
          "duration": 221.818,
          "duplicatesFound": 0
        },
        {
          "timestamp": "2026-02-24T07:02:06.915Z",
          "status": "success",
          "duration": 124.991,
          "duplicatesFound": 0
        },
        {
          "timestamp": "2026-02-23T07:01:42.238Z",
          "status": "success",
          "duration": 101,
          "duplicatesFound": 0
        }
      ]
    },
    {
      "name": "tests",
      "path": "/Users/alyshialedlie/code/jobs/tests",
      "priority": "low",
      "scanFrequency": "weekly",
      "enabled": false,
      "tags": [
        "internal",
        "testing"
      ],
      "excludePatterns": [],
      "_comment": "Disabled: Test files are intentionally similar and not useful to scan for duplicates"
    }
  ],
  "repositoryGroups": [
    {
      "name": "internal-tools",
      "description": "Internal job management and duplicate detection tools",
      "repositories": [
        "sidequest",
        "pipeline-core"
      ],
      "scanType": "inter-project",
      "enabled": true
    }
  ],
  "scanDefaults": {
    "languages": [
      "javascript",
      "typescript",
      "python"
    ],
    "includeSourceCode": true,
    "includeCodeBlocks": true,
    "generateReports": true,
    "reportFormats": [
      "html",
      "markdown",
      "json",
      "summary"
    ]
  },
  "notifications": {
    "enabled": true,
    "channels": [
      "sentry",
      "log"
    ],
    "onSuccess": false,
    "onFailure": true,
    "onHighImpactDuplicates": true,
    "highImpactThreshold": 75
  }
}